<?xml version="1.0" encoding="ISO-8859-1"?>
<workflow xmlns:xsi="http://www.w3.org/2001/XMLSchema-instance"
  xsi:noNamespaceSchemaLocation="workflow.xsd">
  <id>TEXT_FILE_HANDLING_WK01</id>
  <description>Text file handling example workflow 01</description>
  <toolkit_id>TEXT_FILE_PROCESSING_TOOLKIT</toolkit_id>
  <last_repository_id>2</last_repository_id>
  <last_task_id>3</last_task_id>
  <repositories>
    <repository>
      <id>REPO_2</id>
      <numerical_id>0</numerical_id>
      <position>
        <x>2798</x>
        <y>2900</y>
      </position>
    </repository>
    <repository>
      <id>REPO_1</id>
      <numerical_id>4</numerical_id>
      <position>
        <x>2794</x>
        <y>2417</y>
      </position>
    </repository>
  </repositories>
  <tasks>
    <task>
      <id>TO_UPPERCASE</id>
      <numerical_id>3</numerical_id>
      <sequential_id>1</sequential_id>
      <position>
        <x>2646</x>
        <y>2572</y>
      </position>
    </task>
    <task>
      <id>REVERSE</id>
      <numerical_id>2</numerical_id>
      <sequential_id>2</sequential_id>
      <position>
        <x>2968</x>
        <y>2571</y>
      </position>
    </task>
    <task>
      <id>INTERLEAVE</id>
      <numerical_id>1</numerical_id>
      <sequential_id>3</sequential_id>
      <position>
        <x>2799</x>
        <y>2745</y>
      </position>
    </task>
  </tasks>
  <connections>
    <connection>
      <from>
        <type>repository</type>
        <numerical_id>4</numerical_id>
        <position>0</position>
      </from>
      <to>
        <type>task</type>
        <numerical_id>2</numerical_id>
        <position>0</position>
      </to>
    </connection>
    <connection>
      <from>
        <type>repository</type>
        <numerical_id>4</numerical_id>
        <position>0</position>
      </from>
      <to>
        <type>task</type>
        <numerical_id>3</numerical_id>
        <position>0</position>
      </to>
    </connection>
    <connection>
      <from>
        <type>task</type>
        <numerical_id>1</numerical_id>
        <position>0</position>
      </from>
      <to>
        <type>repository</type>
        <numerical_id>0</numerical_id>
        <position>0</position>
      </to>
    </connection>
    <connection>
      <from>
        <type>task</type>
        <numerical_id>2</numerical_id>
        <position>0</position>
      </from>
      <to>
        <type>task</type>
        <numerical_id>1</numerical_id>
        <position>1</position>
      </to>
    </connection>
    <connection>
      <from>
        <type>task</type>
        <numerical_id>3</numerical_id>
        <position>0</position>
      </from>
      <to>
        <type>task</type>
        <numerical_id>1</numerical_id>
        <position>0</position>
      </to>
    </connection>
  </connections>
</workflow>
