<?xml version="1.0" encoding="ISO-8859-1"?>
<workflow xmlns:xsi="http://www.w3.org/2001/XMLSchema-instance"
  xsi:noNamespaceSchemaLocation="workflow.xsd">
  <id>IMAGE_PROCESSING_WORKFLOW</id>
  <description>A workflow combining several image processing tools</description>
  <toolkit_id>IMAGE_PROCESSING_TOOLKIT</toolkit_id>
  <last_repository_id>2</last_repository_id>
  <last_task_id>11</last_task_id>
  <repositories>
    <repository>
      <id>REPO_1</id>
      <numerical_id>0</numerical_id>
      <position>
        <x>2952</x>
        <y>2146</y>
      </position>
    </repository>
    <repository>
      <id>REPO_2</id>
      <numerical_id>1</numerical_id>
      <position>
        <x>3145</x>
        <y>3283</y>
      </position>
    </repository>
  </repositories>
  <tasks>
    <task>
      <id>PNG2JPG</id>
      <numerical_id>12</numerical_id>
      <sequential_id>10</sequential_id>
      <position>
        <x>2772</x>
        <y>2226</y>
      </position>
    </task>
    <task>
      <id>BLUR</id>
      <numerical_id>11</numerical_id>
      <sequential_id>1</sequential_id>
      <position>
        <x>2245</x>
        <y>2411</y>
      </position>
    </task>
    <task>
      <id>CHARCOAL</id>
      <numerical_id>10</numerical_id>
      <sequential_id>2</sequential_id>
      <position>
        <x>2450</x>
        <y>2414</y>
      </position>
    </task>
    <task>
      <id>MOSAIC</id>
      <numerical_id>9</numerical_id>
      <sequential_id>4</sequential_id>
      <position>
        <x>2516</x>
        <y>2566</y>
      </position>
    </task>
    <task>
      <id>OILPAINT</id>
      <numerical_id>8</numerical_id>
      <sequential_id>3</sequential_id>
      <position>
        <x>2655</x>
        <y>2413</y>
      </position>
    </task>
    <task>
      <id>MOSAIC</id>
      <numerical_id>7</numerical_id>
      <sequential_id>5</sequential_id>
      <position>
        <x>2740</x>
        <y>2673</y>
      </position>
    </task>
    <task>
      <id>MOSAIC</id>
      <numerical_id>6</numerical_id>
      <sequential_id>6</sequential_id>
      <position>
        <x>2977</x>
        <y>2782</y>
      </position>
    </task>
    <task>
      <id>MIRROR</id>
      <numerical_id>5</numerical_id>
      <sequential_id>7</sequential_id>
      <position>
        <x>2754</x>
        <y>2878</y>
      </position>
    </task>
    <task>
      <id>ROTATE</id>
      <numerical_id>4</numerical_id>
      <sequential_id>8</sequential_id>
      <position>
        <x>2539</x>
        <y>3001</y>
      </position>
    </task>
    <task>
      <id>GRAYSCALE</id>
      <numerical_id>3</numerical_id>
      <sequential_id>9</sequential_id>
      <position>
        <x>2758</x>
        <y>3077</y>
      </position>
    </task>
    <task>
      <id>JPG2PNG</id>
      <numerical_id>2</numerical_id>
      <sequential_id>11</sequential_id>
      <position>
        <x>2972</x>
        <y>3210</y>
      </position>
    </task>
  </tasks>
  <connections>
    <connection>
      <from>
        <type>repository</type>
        <numerical_id>0</numerical_id>
        <position>0</position>
      </from>
      <to>
        <type>task</type>
        <numerical_id>12</numerical_id>
        <position>0</position>
      </to>
    </connection>
    <connection>
      <from>
        <type>task</type>
        <numerical_id>2</numerical_id>
        <position>0</position>
      </from>
      <to>
        <type>repository</type>
        <numerical_id>1</numerical_id>
        <position>0</position>
      </to>
    </connection>
    <connection>
      <from>
        <type>task</type>
        <numerical_id>3</numerical_id>
        <position>0</position>
      </from>
      <to>
        <type>task</type>
        <numerical_id>2</numerical_id>
        <position>0</position>
      </to>
    </connection>
    <connection>
      <from>
        <type>task</type>
        <numerical_id>4</numerical_id>
        <position>0</position>
      </from>
      <to>
        <type>task</type>
        <numerical_id>3</numerical_id>
        <position>0</position>
      </to>
    </connection>
    <connection>
      <from>
        <type>task</type>
        <numerical_id>5</numerical_id>
        <position>0</position>
      </from>
      <to>
        <type>task</type>
        <numerical_id>4</numerical_id>
        <position>0</position>
      </to>
    </connection>
    <connection>
      <from>
        <type>task</type>
        <numerical_id>6</numerical_id>
        <position>0</position>
      </from>
      <to>
        <type>task</type>
        <numerical_id>5</numerical_id>
        <position>0</position>
      </to>
    </connection>
    <connection>
      <from>
        <type>task</type>
        <numerical_id>7</numerical_id>
        <position>0</position>
      </from>
      <to>
        <type>task</type>
        <numerical_id>6</numerical_id>
        <position>0</position>
      </to>
    </connection>
    <connection>
      <from>
        <type>task</type>
        <numerical_id>8</numerical_id>
        <position>0</position>
      </from>
      <to>
        <type>task</type>
        <numerical_id>7</numerical_id>
        <position>1</position>
      </to>
    </connection>
    <connection>
      <from>
        <type>task</type>
        <numerical_id>9</numerical_id>
        <position>0</position>
      </from>
      <to>
        <type>task</type>
        <numerical_id>7</numerical_id>
        <position>0</position>
      </to>
    </connection>
    <connection>
      <from>
        <type>task</type>
        <numerical_id>10</numerical_id>
        <position>0</position>
      </from>
      <to>
        <type>task</type>
        <numerical_id>9</numerical_id>
        <position>1</position>
      </to>
    </connection>
    <connection>
      <from>
        <type>task</type>
        <numerical_id>11</numerical_id>
        <position>0</position>
      </from>
      <to>
        <type>task</type>
        <numerical_id>9</numerical_id>
        <position>0</position>
      </to>
    </connection>
    <connection>
      <from>
        <type>task</type>
        <numerical_id>12</numerical_id>
        <position>0</position>
      </from>
      <to>
        <type>task</type>
        <numerical_id>6</numerical_id>
        <position>1</position>
      </to>
    </connection>
    <connection>
      <from>
        <type>task</type>
        <numerical_id>12</numerical_id>
        <position>0</position>
      </from>
      <to>
        <type>task</type>
        <numerical_id>8</numerical_id>
        <position>0</position>
      </to>
    </connection>
    <connection>
      <from>
        <type>task</type>
        <numerical_id>12</numerical_id>
        <position>0</position>
      </from>
      <to>
        <type>task</type>
        <numerical_id>10</numerical_id>
        <position>0</position>
      </to>
    </connection>
    <connection>
      <from>
        <type>task</type>
        <numerical_id>12</numerical_id>
        <position>0</position>
      </from>
      <to>
        <type>task</type>
        <numerical_id>11</numerical_id>
        <position>0</position>
      </to>
    </connection>
  </connections>
</workflow>
